电影中文名,电影英文名,链接,年份,地区,剧情类型,导演,评分,评论人数,概述,简介,短评
哈利·波特与死亡圣器(下),Harry Potter and the Deathly Hallows: Part 2,https://movie.douban.com/subject/3011235/,2011, 美国 英国 , 奇幻 冒险,大卫·叶茨,9.0,788786,10年的完美句点。,当又一次和伏地魔（拉尔夫·费因斯RalphFiennes饰）的意识连通，哈利·波特（丹尼尔·雷德克里夫DanielRadcliffe饰）断定最后一件魂器藏在霍格沃茨，于是和罗恩（鲁伯特·格林特RupertGrint饰）、赫敏（艾玛·沃森EmmaWatson饰）一同返回阴云密布的学校。在好友们的帮助下，他们成功驱逐了斯内普（艾伦·瑞克曼AlanRickman饰），然而觉察到哈利目的的伏地魔则率领徒众向霍格沃茨逼近。食死徒、摄魂怪、巨人疯狂涌入这所有着悠久历史的魔法学校，正邪决战旋即爆发，一时间血雨腥风，死伤无数。从斯内普的眼泪中，哈利不仅了解到父辈的故事，也证实了藏缅于他体内最后的秘密。在此之后，他也和伏地魔迎来了最后的对决……本片根据英国作家J.K.罗琳的同名原著改编，也是“哈利·波特”系列影片的完结篇。,"[['一套《哈利波特》花了十年将英伦演艺界老中青三代戏骨大牌明星正太萝莉一网打全尽，扳着指头都数不过来，你说它不是“史诗级”，它能同意么？终于看完了，交作业。', '3'], ['对不起，我看过书，即使在斯内普望着和莉莉一样的眼睛死去的时候眼泪快要流出来，但这仍是书本带给我的力量。我无法忍受如此对一部伟大作品的改变，看似紧凑，却丝毫没有建立起各种人物关系（我想唯一的关系就是将哈利波特的格局变小，变成了伏地魔与波特之间的私怨）只马不停蹄的表面叙事，缺乏细节。', '2'], ['全程亢奋有木有！鼓掌尖叫有木有！最后一部的气势就像是一股元气，囊括了前面7部的情怀与回忆，把情绪推向高潮，一波未平一波又起⋯⋯片尾字幕升起时，每出一个演员名字、华星的观众就鼓掌尖叫一次，那是我作为影迷感受到的最殿堂级的待遇。“爱一个人真的可以是一辈子的事情” - 献给斯内普', '5'], ['终结篇还不给满星的人Voldy不会放过乃们唷！', '5'], ['哈利由必死到无须死的转变交待不清；大围攻一战特效精彩；19年后化妆甚为失败。总体三星，大结局的过命精神加一星。', '4'], ['感谢J·K·罗琳给我们带来的魔法世界。', '4'], ['麦格教授挺身而出的时候我都快泪奔了~~', '5'], ['3D+IMAX观影体验极赞！不得不说，这是除第一部给我带来惊喜以后的又一次盛宴。给予五星并不单纯是因为伴随着这么多年下来的感情，还同时因为影片本身也很出色。情节紧凑，诸多场景颇具压迫感，从始至终满满都是高潮。伴随着那辆驶向霍格沃兹得列车开出，积累两个小时的情绪终究爆发。★★★★★', '5'], ['满分只为一人，Severus Snape...', '5'], ['十年 我的青春期开始和结束。等待十年的霍格沃斯通知书，等来的终是社会的入场券。十年前就猜中它的结局，却没猜中自己的', '5'], ['Albus Severus, you were named for two headmasters of Hogwarts. One of them was a Slytherin and he was probably the bravest man I ever knew.', '5'], ['无论大卫·叶茨的执导水平有多差，观众还是会被这样一个带有自己主观情绪体验的结尾给煽动到的...', '4'], ['完美的落幕！完美的终结！最后字幕结束的那一刻，和青春就这么告别了，以后是不是就意味着自己从此不再年轻？十年的成长，就此般高潮散尽结束了，也许对于我这种看着哈利波特长大的一代人，这最后一部已经不再是一部电影，而是自己的青春告别仪式，是自己的成人礼。★★★★★', '5'], ['五星也是一起纪念青春的（泪目）', '5'], ['总算看完了，对于没看过原著的非书迷来看，被他享誉全球的称赞给绑架了，看的极其痛苦，不看又好像差了点什么，电影的质量只能说一般，所有的打分基本因为是名著有一分的额外加成在我认为，《哈利波特》系列可能是所有名著改编电影里面最烂的系列了，同比《指环王》真是差出十几条街，以后不会再对这种所谓名著和其脑残粉的情怀买单了，及时止损就好，应该在第二部就及时放弃掉，浪费我多少时间', '3'], ['【幼时の装逼】当看罢结局，才发现它并不只是圈钱来的。不像007，不像任何拉着一大堆续集系列，这从第一部就是一个计划，一个唯美的、不明说的谎言，只能不多不少如此一般表现，饱含着童真、爱情、勇气乃至信念，陪伴我们这一代人。所以说，这不是一部电影，是一代人的成年礼。', '4'], ['这是我经历过需要「追」的经典，之后的人们，可能体会不到10年的等待和追逐了。', '4'], ['10Years，Like never before. Like never again. But in our heart, it never ends.看到最后九又四分之三站台、驶向霍格沃茨的列车还有新一代的魔法学生，我真的哭了【永远也不会有如此的青春和陪伴了】 ', '4'], ['仍然是麻瓜', '3'], ['十年一觉魔法梦，这是一代人的青春休止符。施了复制咒的银行金库、火苗肆虐的有求必应屋、漂浮着摄魂怪的霍格沃兹，依然是充满想象力的魔法世界。暗黑哥特风格延续上一集的紧张与紧凑，阿利安娜的油画入口、海莲娜的幽灵对话、斯内普的临终冥想幻像，都在九又四分之三站台，完美地向一代人的青春作别。', '5'], ['在BFI的IMAX看了最后一部HP，我的童年就这么结束了，看到教授们用魔法屏障护卫霍格沃茨时候，差点失控飙泪。BBC啊HBO啊StarZ什么的开始着手拍电视剧吧，这样我的童年还可以延长7季！然后每半年出一个同人剧场版什么的，要不然这辈子没盼头了啊！TAT', '5'], ['嘤嘤嘤看的眼泪掉粗来T^T……从保护霍格沃茨的石头人从墙上跳下来，大家一起防护魔咒就泪崩了好么！！！年青时候的莉莉和斯内普真是超萌的好吗！！！！史上最痴情的男纸斯内普啊莉莉嫁给你就没有哈利波了！！！哈利波的娃和各种娃也萌屎人了！简直让老哈利波们情何以堪啊=_.=', '5'], ['一直没让我泪奔成功，只流下两滴泪，都怪那些友邻害把我期待摆得那么高！', '4'], ['作为一个从来没看过原著的人，我必须给出5星。因为对某些人来说，这是一部充斥着10年情感的大结局，这不是一部电影。就如同建国大业一样，你根本没法也不能去客观地打分。', '5'], [""Snape冰山下的絲絲溫柔讓所有魔法都黯然失色--掌心盛開的雛菊，漫天飛舞的竹蜻蜓盡藏於那濁淚裡，太多的不可言，或太多的無從說起。死前對Harry說的“Look at me”，只因在陷入永遠的黑暗前，只有愛人的雙眸能溫暖他漸漸冰冷的軀體...HP ends but it'll never die"", '5'], ['用十年看完了一部电影', '4'], ['我要打十颗星！五颗给这个伟大的系列，五颗给斯内普的那段回忆！太虐了，虐得我一个大老爷们眼泪止不住啊！！！', '5'], ['无论你在哪里，霍格沃茨永远等你回家。', '5'], ['这几天断断续续重刷了一遍哈利波特系列，重看才理解了一些当年没注意到的地方，理解了为什么很多人那么欣赏斯内普这个角色，可以看出他应该是全书中最有文学深度的人物了。也越发明白了这样一部表面上的“青少年文学”作品有多深远的意义，它其实把一个人从童年到成年期间会经历的种种困境，套上了魔幻的外衣讲出来，贫富阶层分化、校园霸凌、长辈去世、亲近的朋友误会或离开，不难想到那些正处在类似困境里的孩子，可以在其中获得多大的安慰。想到最近在读的那本《讲了100万次的故事》开篇里所说的，只要还有人在讲故事，这个世界就还被魔法保护着。', '4'], ['我暗恋你妈好多年。', '5'], ['有血有泪有情有义的终极黑暗史诗', '4'], ['事实证明，妹控都是不靠谱的，只有人妻控才是王道。“你到现在仍爱着莉莉吗？”“Always...”这一刻我湿了……', '5'], ['伏地魔同志惨烈的人生故事让我在imax影院里泣不成声', '5'], ['散场时久久不能离去，回家的路上仿佛看到自己的一生', '5'], ['伏地魔先森你简直是激萌啊!! 笑场了好么!!! 哈。', '4'], ['从没真正喜欢过这个系列，这个架空世界的逻辑性相当混乱，这一集也许让很多人唏嘘不已，但感情和质量是两码事儿。', '3'], ['等了八部终于有了正儿八经的打斗场面！也是唯一一部真正被戳到泪点。斯内多年普默默守护，哈利对他早已有了特殊的意义，还记得哈利第一次看到斯内普召唤出的神鹿时，他把它认作的，是父亲啊。        还有那个一直以来笨拙迟钝被当作笑话的纳威，却是能够举起格兰芬多宝剑的孩子，他外表柔和实则内心刚勇。敢与命运抗衡的，没有谁是小人物。       正如邓布利多所说：“决定我们成为什么样的人，不是由我们的能力决定的，而在于我们的选择。”', '4'], ['斯内普教授和邓布利多的对话，简单翻译：“明明说好三年，三年之后又三年，三年之后又三年，哈利都长大啦，阿sir。”', '5'], ['老纸要到伦敦看首映！大结局都不给全球同步！天杀的光锭肿菊！你妹的电影保护！', '5'], ['各种不理解，第一次在没有哈波迷现场解说的情况下看哈波。童年的快乐回忆已经变成冗长的黑色的毫无剧情和逻辑的平板“大片”。情节完全没有交代清楚，各种牵强，完全不可以用智商来看的片子。各种貌似神奇的东西已经毫无想象力，好人坏人都用同样招数毫无看点。不知道看了小说的人会不会一样失望。', '2'], ['节奏终于比上一集好多了，但坏人死得都太快，停在伏地魔灰飞烟灭那一刻或许更赞？我前面啥都没看过导致入戏有点慢，但真心好看呐，并且观众的感染力深深影响了我，四星升级到五星。（不过3D效果不明显。）Class Dismissed，跟童年说声再见。', '5'], ['迟到的评价，2011年仅仅去电影院看过两次，一次是变3，另一个就是哈7下！本人的17岁成人礼！10年，不只是一部电影10年，是我们的青春的一把尺10年，用魔法的眼光，丈量世界', '5'], ['这部最经典了，影片后段各种泪点。。。斯内普真是最值得同情的角色了！', '5'], ['麦格教授站出来保护霍格沃兹的那一刻开始，那种很莫名的情绪就开始从胸口溢出，一直到斯内普的保护神出现时眼泪崩溃。哈利蹲下来对着小阿不思说的最后一段话我心里几乎是跟着一起复述出来的。最后一幕停格在铁三角的远目中，然后我想起十年前那三个小孩子在自己记忆深处的最初模样，童年终结在8月4日。', '5'], ['David Yates确实就是渣，除了基本镜头叙事能完成外还会什么？！对于一个只看过囚徒那本还觉得很难看，所有电影都看过但没也感情的人，这片没什么意义。3D是种情怀，展现看世界的角度，所以，这场3D的大战也没什么看头啊。你们这些感慨童年没了的人，怎能体会我那就断结在知道林正英死讯那一刻的童年！', '3'], ['麦格教授不可能下令把斯莱特林的学生都抓到地牢去，邓布利多甚至一直在保护试图杀死他的马尔福。所以这是从根本上违反原著精神的愚蠢电影！！！', '3'], ['一个冗长的故事拍成电影 能表达的东西不足 一部比一部差', '3'], ['长得像黄秋生的帅大叔snape是整部里面最帅最深情最牛逼的那个', '5'], ['看完了，心里满满的又空空的。感动，永远相信邓布利多的哈利，和纳威领导着延续下来的D.A。我想引用一段文字：斯内普教授的扮演者艾伦·里克曼曾说过这样的一句话：“当我80岁了，坐在摇椅上时，我会读着《哈利波特》。我的家人会问我：都这么久了还这样（after all this time）？我会说：从未放下（always）。 ”教授的演员已经过世了，我记得纳西莎的演员也过世了。随着岁月增长，我们经历过小说完结，电影完结，两次告别的孩子，要开始经历演员离世的第三次告别。我永远不会忘记，我十八岁那年，电影最后一部上映，我把它当做我的成人礼。而此刻二十九岁的我，依然相信，这个世界永远有魔法，只是十一岁时给我送信的猫头鹰走丢了。而每个热爱哈利波特的孩子，心里都有一个叫霍格沃兹的学校，那是我们永远的家和后盾。', '5'], ['终章，我并不认为我是哈迷，但是哪怕我只用了几天时间把整个系列看完，我也有一种难以言说的感动，眼泪打转', '5'], ['根本纳威才是救世主嘛，弗雷德、卢平死了真残忍，那个喜欢过罗恩的拉文德也死了，只给了一个镜头，真真残忍，看到罗恩赫敏突然打啵确实心花怒放来着，之前有友邻广播说19年后的哈利造型就像当了霍格沃兹的会计或者裁缝，一直憋着劲等着看，果不其然！果不其然啊！', '5'], ['终于看了最终曲。对于这样一部电影，评论技术和质量大概都是多余的，这也算是对十年记忆的缅怀，尽管在奇幻方面我爱指环王、冰火远胜于HP。我没有看第七部的原著，这是遗憾，也是幸事——这样HP在我这里就还没有结束。', '5'], ['哭得一塌糊塗。。。', '5'], ['一個時代的謝幕完美。愛與忠誠夢想與信念。感動感謝十年來有HP相伴。沒挂的演員都亮了相。有些人死了卻永生有些人活著卻生不如死。鉄三角DA軍鳳凰社。斯内普的潛伏老麥琪的執著鄧佈裏多的如意算盤。伕地魔食死徒咎由自取。三兄弟VS七魂器。19年前大難不死19年后9又3/4車站重逢。傷疤一直沒再疼過。', '5'], ['IMAX效果确实好。我的童年完结得一干二净，QAQ，斯内普太伟大了', '5'], ['唉。烂尾了。。。哈利·波特重返霍格沃兹的时候，真像抗战片游击队战士迎来领导啊。。。', '3'], ['劳资今天去看哈利波特了，乃们就羡慕吧！！！很好看好吗！！！日语字幕看得我很纠结好吗！！！白色空间那段完全没有必要啊看得都要摔了好吗！！！看到我内流满面好吗！！！劳资要不要再去看一遍啊混蛋！！！', '5'], ['当教授唤醒石像设下结界守卫霍格沃兹的时候，当斯内普抱着莉莉哭的时候，当他召唤守护神救哈利的时候，当罗恩妈妈挺身保护孩子的时候，控制眼泪的开关一定坏掉了，不然为什么我会不停哭呢？爱是深沉，爱是勇敢，爱是情愿被误解也要守护下去的信念。众多演技精湛的老戏骨甘为绿叶默默添彩，感谢你们！泪', '5'], ['哈利波特这个系列我看过书的没看过电影看过电影的没看过书一不小心从哈利波特小说第一部看到电影版最后一部，哈利波特电影里这部最棒从头high到尾跌宕起伏不像之前的某些看的我昏昏欲睡。福地魔很帅气呢举手投足颇像谢耳朵斯内噗帅到爆啊帅到爆啊。片子是在姑娘们的啜泣声中看完的一个完美的句号。', '5'], ['3.5 一早都說為什麼還要用這個導演,撇除累積感情分,結局的氣勢,氣氛,細節處理都不太好,節奏是比前幾集快了但仍有點鬆散,鋪排了那麼多集,最後收得實在有點草草了事,與期待中的grand final和完滿終結的感動實在有點距離...', '4'], ['这个东西很重要，不会这么简单被破坏吧！于是被破坏了。这个人很厉害，不会这么轻松就被杀了吧！于是它被杀了。这条蛇很牛逼，不会这么容易就死了吧：于是它死了。', '3'], ['系列电影中最为精彩的一部，无论情节还是效果。居然看哭了T T...10年，就这么成为了回忆... ', '5'], ['由于没看过1-7，直接看7下IMAX，所以不予置评了。过山车那段IMAX 3D效果大呼过瘾~', None], ['即使银幕上再不会有你们更新的画面，但HP的故事永远会印刻在我脑海里。银幕渐暗，观众散了；灯光亮起，梦醒了，是时候该长大了。感谢HP，七本书、八部电影陪我走过十年。再也不会有哪本小说让我通宵啃读，也没有哪部电影会让我有跑首映的冲动，没有哪个我从未走入的世界，可以让我如此流连忘返。', '5'], ['2011.8.4 上映第一天人好少哦；高潮迭起；伏地魔一直眼泪汪汪的；19年后真不咋地……；看3D不如看imax 2D~', '4'], ['可能太期待了导致前一晚失眠，看的时候反而没那么惊心动魄，作为一部电影客观的讲3.5，结构松散简略带过3D效果一般，但它不止是一部电影，它包含了太多感情太多的回忆~万达CBDIMAX 6排8号 ', '5'], ['哈利波特人傻并且女朋友个个丑到爆就算了，可是为什么要把伏地魔那么帅气的BOSS拍的像个白痴啊？波特成为精神领袖的人格魅力完全匪夷所思，少年战胜恐惧成长的戏份也一样也没写出来，他和伏地魔间有趣而纠结的灵魂附属关系也完全拍废了！虽然视效很shock但还是太不爽了。。', '2'], ['勉强看了个抢版的，实在忍不住看了，哥哥对此电影的一切都成了过去了，记得以前一年一年等这看书。最后那个老年扮相实在是不怎么样啊，完全是发育不好的结果。', '4'], ['波特跟他爸都是臭大粪神奇男孩黑不解释 教授这个圣母大苦逼，罗琳你这个后妈QAQ完结篇比前几部都要好，可是魔法什么的一直是诟病，你以为是放烟花呢，比谁放的大放的好看吗= =又及神奇男孩和伏地魔真的不是官配么，相爱相杀虐恋情深 还有触手捆绑，最后决斗的时候根本就是随时准备亲上去。纳威真男主！', '4'], ['在电影院怅然若失。。。不仅是一部电影的结束，更像是一个时代的完结。在我心里这部电影是超五星的。每一场戏，每一段配乐都是高潮，当然也有的地方想要吐槽。很久没有一部电影让我这样从头到尾一直揪着心，不能平静。当那辆红色的火车再次驶出时，我们都流泪了。故事永远在心里，不曾完结。', '5'], ['第一次看哈利系列，比预期要好，比变三好，至少有剧情，也有我的斯内普教授和伏地魔先生的演技，最重要的是魔法的魅力，魔杖有点幼稚，但能飞啊，那是永恒的浪漫。我没变，还是十年前的我。', '3'], ['從霍格華茲畢業了，陪伴十年期待結局又不捨離開的複雜情緒。打從第一集舊深深被石內卜黑色裝扮與蒼白面孔吸引，拜託給他更多鏡頭！！！！英國經典演員攜手合作的大片50年後在翻拍也不會比現經精采。ＰＳ：50年後的哈利可以改演多比了哈哈哈哈', '5'], ['其实是做好了各种准备要给五星的，逾10年的成长，只为了这点感情也是应该。但可能真的是期望太高，又是一致的好评，带了太多的期待去看。麦格教授和Snape一出手我就哭了，但主要还是因为喜欢这些教授。后面的戏没想像的那么精彩，平淡也许是个书的好结尾，但在史诗般的电影中，不足以平复情绪感到满足', '4'], ['终于完结了整场看完一点反应都没有，如果非要说点什么就只是剩下空虚。 3D很失败！！！ 人也都长挫了唉没有任何人物刻画打斗场景也不N逼仅仅有亮点的也就是斯内普教授的大脸以及几个小正太了。哎 再见波特！', '4'], ['每一个镜头都可以成为精美剧照，音乐宏大到极致。最后红色火车轰隆隆远去，标志一个时代过去了。愿今天同看的你们十年后仍陪伴在我身边，我的朋友。', '5'], ['其实每一部HP电影，都无法给我带来小说的愉悦感。遥想孩提时，仲夏夜，凌晨等着看球，可以一本接着一本的读完，反而忘记看球了。等到天空鱼肚白了，合上几本哈哈哈，一本满足的进入梦乡。不过，这终究是一个系列的圆满结束，想到从此以后，每年少了这样的2个多小时，也挺遗憾的。', '4'], ['纪念逝去的青春，纪念那个她，Jenny，I miss you', '5'], ['虽然我觉得是4星！提前知道的两个泪点我没哭！但斯内普叔那段都涩到喉头了！从看见霍格沃茨戒备防御那时我就不行了，看到它被破坏成那样讲不出来的难过。不过之后想想巫师们可以很快复原它就舒心了~ 三人互望牵手时想到以后他们要怎么跟自己的孩子说这一段往事，其实我们跟他们是一样的！生个巫师吧！', '5'], ['看到斯内普死的那段和Lily说always be with you那段真的泪奔了...结尾时是该有多舍不得。多想一切回到当年那个9 3/4站台。多想HP永远没有end。', '5'], ['笑点依然很多，但太伤感了，斯内普太伤感了。。。让我面对波特兄和黑老大的双人蹦极都笑不出来。。。', '5']]"
