电影中文名,电影英文名,链接,年份,地区,剧情类型,导演,评分,评论人数,概述,简介,短评
大佛普拉斯,None,https://movie.douban.com/subject/27059130/,2017, 中国台湾 , 剧情 喜剧,黄信尧,8.7,429555,人们可以登上月球，却永远无法探索人们内心的宇宙。,菜埔（庄益增饰）是一家雕塑厂的夜间保安，家中有一位重病的老母亲需要照顾。肚财（陈竹昇饰）是菜埔唯一的朋友，菜埔经常在值夜班的时候把肚财叫过来和他作伴。一天，两人突发奇想决定看一看菜埔的老板黄启文（戴立忍饰）的行车记录仪里记录了哪些影像，希望向来风流的老板能够贡献出一些精彩的片段以解两个独身男人内心里的寂寞之苦。行车记录仪所记录的影像果然没有让菜埔和肚财失望，但与此同时，两人也发现了黄启文的许多不可告人的秘密。实际上，菜埔和肚财的一举一动皆没有逃过黄启文的眼睛，为了保住自己的地位和名声，他决定采取一些必要的行动。,"[['「雖然現在已經是太空時代了，人類可以搭乘太空船到達月球，但卻沒辦法看穿每個人心裡的宇宙。」', '4'], ['看到“我要你干我”的时候家里人推门而入，真的百口莫辩', '4'], ['有点茶馆听说书的感觉。市井乡氓的卑贱生活，乱象丛生的台湾社会，咿咿呀呀的旁白带来拍案惊奇的效果。在低俗猥琐中接地气，在黑色荒谬中怜悯，人生已是烂泥打滚，揣着一颗佛心才能普度——对小人物来说，平安是福...', '4'], ['树顶仔一只虎头蜂，莲雾开花满树红，电影色彩阶级学，有钱人的世界是彩色的，三餐海产呷鱼块，假发一天不戴不安心，闽南三尺有神灵，大佛肚中众生相，一口一个阿弥陀佛，一口一个干你娘，念念不忘，必有回响～', '4'], ['你永远不会知道他人的皮囊之下，到底藏着什么样的秘密。就像你不会知道，万人朝拜的菩萨肚子里有一具死尸，也不会知道一个收垃圾的大叔，屋子里摆满了洋娃娃。', '5'], ['黑白影调与有钱人的生活是彩色，似乎把问题抛向了绝望的阶层分化，但弁士说书人的口吻，兼有道听途说的打趣和人生空空如也的抒情，巧妙地渗漏掉老司机开车上路的金钱性事狗血，完成黑色幽默到虚无文艺的主旨提升。谈笑风生间是轻松加愉快，但不知道为什么，总有种让人想哭的吴念真·酸。', '4'], ['那时我们还太年轻,不知道上帝已经在暗地里给每个人都准备好了最后一顿饭。', '5'], ['這不完全是黑白片唷。因為有錢人的世界是彩色的。以黑色幽默包裹的社會寫實劇，很貼近台灣社會。導演黃信堯後設的口白，不僅是趣味，也巧妙中和了故事裡那種幾乎沒有出口的黑暗抑鬱。社會階級分化，貧富差距，宗教政經的金玉其外敗絮其中，諷刺的超到位。拍了一個很棒的結局', '5'], ['有佛无慈悲，有性无爱，有法律无公正，有警察无正义，满满的绝望。“当然有困难...对他们来讲，无论是出太阳还是下雨，都会有困难，但他们没办法去想生命的困难...社会常常在讲要公平正义，但在他们的生活之中，应该是没有这四个字，毕竟光是要捧饭碗就没力了...”', '5'], ['干！这片要是放在春节档我会刷十遍，比99.9%的贺岁片都有趣，但，片刻的有趣过后却是莫名的感伤和悲凉，俏皮的台词不止是博观者噗嗤一笑，更是导演和角色的自我解嘲，导演的旁白同时达到了调侃、补充和间离的多重效果。看似天马行空实则举重若轻，耍纪录片的导演拍的悲喜剧，轻盈的实在不像处女作。', '5'], ['“我们已经可以依靠科技进入外太空，却依然无法走进一个人内心的宇宙。” 忍俊不禁的小幽默，互相打趣的小人物，上演着一出出悲伤的人间喜剧。富人的世界永远是彩色的…', '5'], ['Puta是大佛、大佛是Puta，老司机一路开车尽显灯红酒绿。粉色摩托潇洒自在，娃娃飞碟一方净土。依老衲看，神明鸾文是假、大佛显灵是真，即使乞丐养猫自身难保，友谊也会地久天长。', '5'], ['虽然真的是老生常谈，但真正优秀的文化作品还是大概率孕育在自由的土地上。', '5'], ['之前还纳闷为什么没有删节版，因为这玩意儿根本没法剪，从头黑到尾，和社会主义价值观格格不入......却是台湾乃至整个华语电影圈近年来最出色的作品之一，底层灰暗失语，政商荒淫无度，心中怀着Budda，身上趴着puta，肚财留下一个苍白身形，释迦留下一句无趣台词，结尾的大佛异响绕梁不去 ps 林生祥的配乐虽然已经非常般配，但我还是想让五条人再来配一版哈哈', '5'], ['厉害，粗粝的影像与精致的声场形成强烈化学反应。全片弥漫着一种错位的美感，在即将化身迈克尔哈内克的途中变身科恩兄弟，又猝不及防还魂吉姆贾木许，而一切竟是以本土台湾八点档的粗鄙之感作为基石，一切元素在导演手中腾转挪移，构建出一个抛弃阶级打破惯性的新无产宇宙。', '5'], ['年初就看到这样一部极高水准的独立作品，让我对未来十个月的观影运气表示担忧，用幽默戏谑的口吻来讲惨淡的底层现实与粗鄙的乡野风貌只是表象上的好。更欣赏是其中混杂的虚无主义带来了一股前所未有古怪美感。有种黑不隆冬听完全场华严经的感官错觉。', '5'], ['世间权钱二字，人分上下两流。上流锦衣玉食，骄奢淫逸，干尽下流的勾当；下流残羹冷炙，囊空如洗，只以上流为榜样。大佛虽有，信仰全无，又能怎样！', '4'], ['电影的魅力也许就是看了一个月的新闻联播，也没有缓过来。活到这岁数世间的道理也没懂多少，可肚财真的买不起足够喝醉的酒啊', '5'], ['你知不知道有一种说法，说人白天诵经文，晚上会梦鬼神，因为在消业障。为了图安眠，有人躲进满是娃娃的太空舱，有人躺在浪涛声声的吊床上。有人掉光了发，有人被鬼神扰。人生希微得说不出一句话，命运憋闷得出不了一口气，谁不是躲在大佛腹中诵经的人？后来有个人替我诵，说噩梦他来做，而功德都赠我。', '3'], ['戴立忍演得太棒太棒了，神了，真.衣冠禽兽。可惜两年没有能看到他演内地的戏了。以后大概也看不到？', '5'], ['有着多年纪录片制作经验的一位老电影人的故事长片处女作。它打破各种框框，处处是惊喜，是新意。只是展示多于描绘，噱头多于深入，影响了作品的厚度及观众的理解。', '3'], ['不黑不色不幽不默。', '2'], ['殘酷的是...僅僅是觀看這些人的日常生活都有些獵奇，把悲傷的事情用喜劇來表示，更顯荒謬', '4'], ['一部完全被高估的作品。当小聪明变得泛滥，那么它就是影响作品本身的负面因素。大量的导演阐述旁白破坏了电影本身的视听语言，对于故事细节与情绪的建立一股脑的通过旁白来表达，太掉价。', '3'], ['好看的都是嘴炮，叙事全靠旁白。', '3'], ['黑色幽默的地方饶有趣味的呈现出地方风貌，又有对惨淡现实的讽刺挖苦。多方面把罪与罚不经意间铺陈开来，以零碎的琐事对事件做全面性描写。最后一幕失了活力，变得颓废，但结尾尤赞也早在意料之中。导演的碎碎念每每出来，都能拯救叙事的裂痕，却不生厌。OST可以说是年度最佳了！', '3'], ['前半段以为是描述废青的社会片，中间部分以为是悬疑片，到了最后才发现这部片子的容量太大了，一言难尽，满分电影就应该是这个样子吧。', '5'], ['偷窥，间离，讽刺，适当的伤感', '4'], ['菜埔对着小叔吞吞吐吐屡次被打断那一段最悲伤。那一瞬间希望有人听他说话，哪怕一秒。', '4'], ['佛陀低眉，是不忍视，那些日夜上演在他眼皮底下的人间乱象。导演自带吐槽模式，是蛮有意思的想法，但旁白过满，过于热衷帮观众划重点，掌握中心思想，填塞了影像之余的每一寸空间，恨不能交待得巨细无遗，就欠了思索和回味的余地。你不妨在信息上啰嗦，但不能在意思上点透。从聪明到匠气就这点差别。', '4'], ['3.5。稳妥三星水准的一个半小时收以十分钟的五星豹尾。鉴于片名和薄弱的叙事联系，感觉整部片可能都只是那个点子的发散思维成果而已。所谓“彩灰喻复穷”的作者性呈现开场不久后就被一场场全知视角的富而灰戏码逐步消解，最后只剩不成系统的电影感维持。太多立场先行、过度阐释的处理让讽刺沦为娱乐。', '3'], ['#1080p#我愿意花一整天看一群陌生人唱歌演戏，却不愿意认真倾听身边的人念叨唠嗑一个小时。这不是他人的问题，是我已经对生活失去了热情，麻木不仁，拒绝去了解和适应一切。面对着现在这个与肚财、菜埔一同生活的世界，越来越厌倦，越来越绝望，但卻不能潇洒地抽身离去。生而为人，真是没劲透了', None], ['秦昊的假发梗是从这儿模仿的吧？把中年男人假发掉落这么滑稽的场景重新演绎出恐怖氛围，戴立忍可以算是第一位。', '4'], ['大喜大悲，如鲠在喉。', '4'], ['此刻我在上海，有钱人在露台晒太阳，我在背阴房苟且。', '5'], ['如果把那些尴尬腻歪的台语旁白去掉，再把故事精简到80分钟以内，结尾再来个大佛藏尸……我也许会考虑多给个1颗星。', '3'], ['间离效果并非源自技法，而是本身叙事的断断断续，事先张扬的旁白拯救贫瘠感。一种观视结构：通过屏幕/杂志（媒介）观视富人阶层，完成想象性的社会阶级跨越——苦中作乐。富人阶层还是逃不过被观看——法相庄严的大佛俯瞰众生；而观众将一切尽收眼底，所以说是谁在看，谁在被看？这是亮点。', '3'], ['对贫富鸿沟既无洞见，也无行动，像条原地咬尾巴的狗。结尾肚财的葬礼中，他的遗照分辨率过高，绝不可能是截图得来。所以全片只是在歌颂一个“高清化”的平民，和一个摆拍的姿势。', '1'], ['非常有趣的小成本黑色喜剧。纪录片出身的导演打破第四堵墙用画外音直接与观众对话，把剧情片玩得很6，笑点很多。配以黑白交织的画面，妙趣横生。一些留白也不错。剧情和《我叫刘跃进》有点像。把台湾底层流浪者、小市民的状态表现得很到位。陈竹昇和戴立忍演得好。独特的原创配乐亦很有喜感。四星半', '5'], ['这个导演评论音轨的设计好赞，我这么反感画外音的人都服了。', '4'], ['这个Plus真的用的好，人心宇宙，肚财，空空佛腔，都填了些什么进去？', '4'], ['還不錯！真心認為，鍾孟宏當中島長雄就好，而且他的技術團隊確實強大。劇本有軟肋，感覺快坳不下時，導演的賣藥電台式口白就出來了⋯後設味強的畫外存在（也是許多youtuber玩的），無疑比吳念真那種搏感情足甘心（卻早已氾濫廣告而信用堪慮）的老派溫敦，更吸引現在這個世代，一種「台味」的新可能。', '3'], ['外在是佛光，内里是谋杀。Buddha和Puta又有怎样的不同。不分昼夜捡破烂的我，为什么不可以拥有一间摆满玩偶的太空舱。', '5'], ['最珍贵的是导演的沉稳，猎奇的部分营造得平缓自然，默然而至的伤感桥段竟也充满感染力。蜻蜓之眼，人间失格。', '4'], ['最近这些高分华语电影怎么都像一个模子刻出来的，姿态形式做得很足，可故事就单薄了许多，符号化的讽刺批判，生拉硬拽的黑暗悲凉，反正只要是底层叙事，站在鸡蛋一边朝高墙吐口水就够了。这个故事比较适合拍短片吧，中间行车记录仪放了就快半小时，看得犯困。', '3'], ['这片子非常犀利，但剧情并没有特别过分，而是手法里透出来的激进。它用各种办法间离你，导演站在后面，评论这部片子和人物，不让你有半点沉浸，每当你要看进去了，他就告诉你，这是电影，快出去。它让你远观，让你思考，让你不会停下来，虽然节奏是很慢的，叙述是克制的。#黑白也有双重意义#', '5'], ['一边是边缘人的黑白世界，荒腔走板，沉迷于夹娃娃机的中年男人，每天互相问候母亲的工友，在雨夜共享便利店过期冷冻食品的友谊，一边是富商政客的彩色世界，每一个暗室里的荒淫无耻。小人物死后一个长长的镜头扫过黑白的稻田，林生祥的背景音乐充满悲悯深情。而大佛总是冷眼低眉，据说那叫无情慈悲', '5'], ['小幽默、小聪明以及小悲凉。导演画外音的碎碎念刚开始还非常新鲜，但多了之后让人厌烦，过犹不及。配乐实在加分不少。。', '3'], ['啊堯導演肯定覺得故事片可以亂來，才如此在敘事上胡作非為。其實當然可以，只是該始終記得，電影的流動時間理應是互相貫通的整體，而非由偶發的幽默/見地組成。行車記錄器可被辯解為紀錄片所留下的習慣，但看來仍像偷懶的小伎倆。中島長雄無時不在炫耀自己的存在，絕對把這個片減分了', None], ['慈悲的大佛身体隐藏罪恶，低微的人类的心灵也有广阔的宇宙，导演的对台湾底层的挖掘很深入，人文关怀令人感动。另外导演的黑色幽默处理，和打破第四面墙的评书语气虽然不新鲜但实在是切合这个故事表达，剧本很厉害。[A-]', '4'], ['电影正片就能享受导演评论音轨（或者说官方弹幕）的效果加分。闽南语加分。真实不洒狗血的底层人视角加分。结尾加分。摄影加分。', '5'], ['全程都是四星观感，知道会很跳跃很实验很讽刺，没有超出预期的内容。直到最后肚财家里的那个飞碟登场，一下子被震住了。看到肚财的遗照的一刹那心想，哇哦，这个导演放开了，是真性情，而且一点都不低俗。这个片子，看上去是揭露阶级矛盾社会问题，实际上是在探索人性宇宙黑洞，很牛逼。', '5'], ['打开视频电影还没开始就听见导演讲话，还以为自己开成了评论音轨，捣鼓半天发现这就是电影的音轨😂。电影确实很有趣，黑白影像也与苦涩的生活紧扣，人物性格也很鲜明，更何况还有个衣冠禽兽之王戴立忍呢！不过呢，电影本身因为要侧重这些幽默和色情，主线显得单薄了些而且故意有一些留白。最终也只能停留在无奈的 “生活很操蛋，富人奸淫掳掠。可是还能咋办？讽刺讽刺得了”', '4'], ['段子集锦。故事会。片子没有片名给力。我觉得他拍A片肯定比拍这个好看多了……导演跳出来解释剧情（而且音轨还有杂音）这件事挺……可爱的。吐槽没问题，但这槽吐得也太直白了，为了吐槽而吐槽。林生祥音乐不错。林美秀的表演还是那么好。', '3'], ['普通人只是端着饭碗，就已经用掉了全部力气。边缘人活和死都像蚂蚁一般，罪恶装进佛像受万人朝拜，而真的释迦到处走走逛逛什么也不做。', '4'], ['有佛无慈悲，有性无真爱，有法无公正，有情无净土。佛系小镇零余人，阿弥陀佛干你娘~', '3'], ['完蛋了啊我，看友邻们的短评都写得好犀利，而我只学到了啥“欢乐棍”“靠北啊”“干妈啊”“肾脏保养”“摄入腺排毒”“543”“靠妖”完蛋了完蛋了', None], ['4.5 近年看过最好的华语片了。', '5'], ['3.5；“作者”介入叙述的古典（说书）模式，除刻意的间离感，另有佛眼俯瞰之意，众生的贪嗔痴恨爱恶欲在人为修改的“宝相庄严“”中尽览无疑；形式感较强，情节跳脱，既为凸显黑色荒诞之意，也是怪奇百状的现实缩影；结尾着实有力道，将之前零散的信息归拢到一条无尽黑的幽深道路之上；原声值五星。', '4'], ['角色無明顯動線&欲求，敍事節奏靠幽默與導演口白支撐；視覺節奏靠動&靜的鏡頭，建立鏡頭&拉縮中景、特寫鏡頭來交錯剪接；撐過了開場，中段便顯露無力至終。主題不夠明確，想表達的議題太多，無法扣進人物深化議題辯證，於是黑色、諷刺、抒情、浪漫各類風格無法統整。角色不知道有澳門首家線上賭場嗎？', None], ['凶杀、色情、中正庙、出丧队、官场腐败，完全是八十年代《故事会》的风格，可惜现在我们完全不敢拍了。对商界、政界和宗教界的嘲讽和对小人物惨淡人生的展现不动声色，旁白极尽八卦口吻，却带出淡淡的悲哀。故事留有余味，而“有钱人的世界才是彩色的”已经说明了一切。', '4'], ['大佛有多庄严，世界就有多荒诞；底层人物的命运有暗淡，豪族政客的生活就有多浮夸；电影有多黑色幽默，现实就有多沉重悲酸。穷人偷窥富人的奢靡，富人膜拜大佛的威严，而大佛一边轻蔑地俯瞰一切光怪陆离，一边又为善男信女们藏污纳垢，导演真是拍的一手好反讽。比起《寄生虫》，同样是反应上层阶级和底层民众的分化，《大佛普拉斯》更高级、更有艺术性，也更耐人寻味。', '5'], ['开篇即立的解说旁白，作为强烈的形式之物，竟能有助于本身已经很丰富的剧情去上升到某种哲学思考高度，当然这也得益于导演的刻意引导，让观众既脱离故事重获上帝视角，又跟随小人物命运沉浸剧情。行车记录仪的妙用，更是把这番沉浸把玩出了窥视传递的乐趣，员工看偷情，我们看悬疑，而最终一起置身大佛', '5'], ['是真的好，真難得看到台灣出現這麼一部如此local有力的黑色電影，把台灣社會媒體政商宗教諷刺了個遍，連幽默都很高級。ps：看到陳以文和戴立忍配對演出，真的瞬間穿梭回楊德昌年代', '4'], ['特别好，整部电影都有种低到尘埃里又生出来高贵的劲....', '4'], ['创意佳，该有的都有了，就是缺点韵味，摄影有些死板，黑白与彩色交叉没必要，演员出彩，尤其戴立忍、陈竹昇，女演员声音出演也性感。', '4'], ['故事不夠緊密或主軸清晰是刻意的，醉翁之意不在酒，正如片名一樣plus的荒謬，草根社會底層性非常之強，將無奈感凸顯而出，就不跟你說你想知道的殺人風雲，而從所有事件的開端起始娓娓道來。形式的融合有趣，黑白色彩，鏡像真實模糊，視角清晰可見，怎麼說都比一路順風要好許多。當小籠包對上雞腿', '4'], ['用上了吃奶的劲完成的却是一篇中学生作文', '2'], ['性是两个世界的交点，一边是火焰，一边是死水，但火焰之下全是罪恶，死水微澜却富有宇宙。宗教沦为遮羞布，信仰多是自我粉饰。配乐和旁白都是叙事的构成，各自出彩。“三分靠作弊，七分靠背景”，虽只是部分事实，却表明了在和平年代，社会阶层不易跨越。', '4'], ['魔幻又荒诞，是Buddha还是Puta，片名的“大佛”就是最大的讽刺。皮囊之下皆有秘密，佛像里藏着死尸，捡废品的大叔房间藏着装满了布娃娃的飞船。世界不仁，社会不义，法律无公正，警察无正义，有钱人的人生，果然是彩色的。只剩我们这些蝼蚁相互倾轧，摸爬滚打，苟且偷生，连捧饭碗都要用尽全力，哪还有力气想什么公平正义。看，连他们的名字，肚脐，菜脯，都这么不起眼。“等我有钱了，我也要取个英文名。”纸醉金迷，声色犬马，妖魔鬼怪，这世界真是从根上烂透了，烂到底了。', '5'], ['更注重呈现而非叙述，凶杀案真的仅仅是一个噱头，主要还是给我们展现了“有钱人看到的世界是彩色的，而他们看到的是黑白的”这一核心观点，用黑色喜剧来讲述的底层故事，并不具有很强的说服力，但还算讨喜。', '3'], ['用自嘲口吻的旁白反向弥补了作品连贯性与现实性上的失真和跳脱，混杂着作为第二考虑范畴的影像共同组合成一个不上不下的荒诞矛盾体，看似若有所思，却又不知何去何从，在这个层面上讲，导演说的确实比做的好。', '3'], ['很台。画人形的那段拍得真好。两个人在下雨的暗夜里傻站着也很好。住在海滨别墅的神秘释迦也很好。阿弥陀佛当句号用的对峙也很好。蒋公庙的极简风也很好。穿过隧道的大佛更好。假发，佛像，太空船，娃娃机，行车记录仪……都成了秘密的掩体。', '4'], ['细节的繁简彰显功力，特别是语言絮叨处的干你娘和阿弥陀佛两段，有点早期张作骥的意思。但导演旁白并不高级，其意义差不多就是不断总结感慨加划中心思想，表面看是追求形式活泼或者忍不住，其实背后的根源还是境界问题。', '3'], ['匠气太重了，但是用心是好的。旁白部分，成败都在这儿了。', '3'], ['这么高的分数结果电影一点也不精彩，也就除了偷窥比较猎奇。', '1'], ['「虽然现在已经是太空时代了，人类可以搭乘太空船到达月球，但却没办法看穿每个人心里的宇宙。」靠北！这居然是导演的大银幕处女作。又黑色幽默又很操蛋的电影。一群生活在夹缝中苟延残喘的人，无家可归，从肉体到精神的流浪者，这些底层人民的世界只有黑白，有钱人的世界才配拥有五光十色。★★★★☆', '4'], ['你说我是Buddha 还是Puta？是我的比较紧还是他的菊花比较紧？我能有多厉害还不是喜欢你干我：）风雨无阻去看黄片的只有娃娃和杂志的孤独男子，被断头的大佛，听到吸允手刹的好听声音就会勃起的生殖器我也想要一个，想体验遮住裤裆的难堪。抽离却又真实的画外音，你要知道一切都是主观的。所有被压抑的，都在这个黑白的，阴冷的，扭曲的，腐烂的故事里转化成了性欲和暴力。行车记录仪里世界是他们看见的唯一彩色的世界。济世救人的佛祖不过是人们发明出来掩盖自己阴暗面的东西。假发戴久了以为是自己的真头发。美丽的话说多了真的以为自己有美丽的心。某片土地还是比隔壁好多了，有这么出色的影片可以出来。在屋顶上的那张脸绝了。让我想起大象席地而坐，只是更直白更露骨。配乐不错。肥肥的男性裸体看的人有呕吐欲。Buddha就是Pu', '5'], ['拾荒大叔家里摆满毛绒娃娃，慈悲的大佛身体里装着尸体……', '4'], ['喋喋不休说教灌输式的旁白简直想要掐掉，但是转念一想，掐掉之后，这片就只有各种小聪明了', '2'], ['“他死了至少尸体会画个人型，我死了估计只有尸水的形状了吧。” 如此悲伤绝望的文本，所配的画面却是演员担心面煮糊了扭头去搅这种日常。 磅礴沉重的情感被柔和地包裹后，所得到的效果事半功倍。   有钱人的世界才是彩色的，而底层人连性都被剥夺，只剩下了最基本的食。甚至偷窥有钱人的性去缓解饥渴压抑，都要用死来换。        如此现实的题材却有一种独特的奇幻感。    三分靠作弊，七分靠背景。 ', '4'], ['自我的生活黑白，他者的生活多彩，荒谬则是不合时宜出现的真相与事实。打破第四面墙，行车记录仪对画外想象空间的开发，其实触到了直接电影与真实电影的分野和媒介纪录的虚无性的边缘。但唬人的实验风只是导演不想给自己的首部长片丝毫设限的放飞自我：「我们常常会看到，但我们不知道自己看到了。」', '3'], ['导演拍纪录片出身与观众对话的幽默旁白代入感间离效果极强。上映好久后院线还几乎满场，虽然有些观众大笑的地方梗不太理解，但非常黑色讽刺黄暴的故事金马要把大奖给他会让人佩服。用阶级区分的黑白彩色，行车记录仪视角与偷窥的遐想，主演陈竹昇客串过嘉年华的旅店老板，押越来越像张震的戴立忍拿男配吧。', '4'], ['粉色的车屁股是不让你对这世界彻底失望的最后一抹风景。', '5'], ['大佛普拉斯，好电影啊，真好真好。台词也真的好有意思。很喜欢某些“喻意丰富“的台词意境和直白口语之间因碰撞而产生的化学反应。在过着黑白人生的肚财和菜脯眼里，老板启文的人生是彩色的，即使只是行车记录仪里路边簌簌闪过的景色也是绿绿葱葱...总之导演好会玩黑色幽默。(衣冠楚楚是人，苦涩心酸是人，肮脏龌蹉也是人...佛普度众生？佛映射众生。——————已经第二天了，我还在因为这部电影而感到丢丢难受丢丢无奈，后劲有点强啊。', '5'], ['很有意思的電影，三俗得來又有點文藝，有趣得來又有些傷感，旁白那麼多卻很自然，演员讚，想看菜脯和肚財這個組合演十個系列！那個在敲擊聲中陷入長長黑幕的ending，如導演說：你是否覺得自己已置身大佛之中？', '4'], ['现实主义的尽头是魔幻。让我到你肚子里看一看', '4'], ['为什么台湾电影可以这么大胆/有钱人的世界是彩色的/虽然现在是宇宙飞船时代………/导演很厉害，从电影刚开头导演的独白开始就感觉是在听朋友讲述身边真实发生的一个小故事', '5'], ['非常奇妙的一次观影。不管是旁白打破第四堵墙还是行车记录仪的形式，真是妙趣横生。其中又有悲悯又有金句，比起短片进步实在是太大。PS：有钱人的世界才是彩色的光怪陆离，穷人的世界只有黑白和小粉摩托。', '4'], ['勉强及格。钟孟宏监制加掌镜，和《一路顺风》略同。调皮倒是更调皮了，画外音和角色的对话、厚脸皮车震、介绍冲浪配乐和小粉车之类是散在主线上的清凉 ，但主线未免疲软了些，所有角色都沉浸在特定状态里，俩主演的戏都很呆。钟的摄影大部分不好，调色太差，但也有类似冢本和石井的超现实时刻', '3'], ['有德西卡的感觉，大部分与黄信尧同龄的华语导演都只是在佛身里锤墙的水平，极少数几位在共享外面的世界，问题当然也有一些，都是小毛病，吹一波。', '5'], ['镜头语言很不错，许多中景镜头只拍了人物肩膀以上的部分，并在景框上方留白，非常耐人寻味。评论音轨和旁白二合一的手法还是第一次见到，充满了实验色彩。去掉旁白观看，情节完整，但节奏发生变化，叙事上有大量留白，摄影充满隐喻。去掉画面只听声音，竟然是一部完整的有声小说。导演真是个人才。', '5'], ['导演奇异的风格最终成了影片的最大看点，被过分放大的阶级差距，到了荒诞的地步，虽然突出了中心，但还是太刻意了，包括那个旁白，也感觉过于卖弄，果然不是自己喜欢的类型。最触动的镜头来自菜铺在肚财死后去他家里看到满屋夹回来的娃娃，才发现自己从来没有了解过他的朋友到底有多寂寞，佛都不知道该怎么做佛，人又该如何去做人呢。', '3'], ['好，但只做到了市井小说的完整度，人物比较单面。可能还喜欢爆裂无声多一点。', '3'], ['仿佛一个天真的小孩看到了一个龌龊的世界', '5'], ['说书式的娓娓道来，带着不着痕迹的力量。谁又不是蝼蚁，活着即是偷生。是黑白还是彩色，一眼望过去全是疮痍。', '4'], ['#BIFF# 只有绰号的小人物 vs Big Name是黑白 vs 彩色，也是行车记录仪的内与外。行车记录仪造成的声画差异鼓励了想象，一如不同阶层对对方的想象。而穷人只能用报纸被捕时的截图做葬礼照片，是最讽刺。Meta意味浓的旁白部分成功，作为OS叙事的功能如果彻底抛弃就好了。结尾很妙。', '4'], ['如同割掉大佛的头颅方能知晓个中秘密，行车记录仪影像内外的、被记录的与在窥视的，都被逐渐剥皮露芯；不时跳脱的“导评音轨”疾速加剧了这份不留情面的彻底。短片大佛是部略类型化的黑色喜剧，而大佛+不愧普拉斯，扩容变成一卷微缩的百科全书，所及之处尽显尖刻。', '4'], ['#金马54#构建了一个具有纪实感的贴近台湾南部乡镇地区真实生活的地带，却又有充满未知神秘奇异的新鲜空间的既视感。行车记录仪的记忆画面导入显示器荧幕，小小的视窗成为被禁锢在此地的底层人物窥探彩色世界的大大窗口。黑白的乡镇影像并不枯燥，反倒有着隐秘而玄妙的力量，摄影和调度都太惊人了。', '4'], ['思想性批判性足够，还能兼顾可看性趣味性，无愧为文艺片PLUS~', '4']]"
